{
  "version": "1.0.0",
  "sprint": "S7",
  "upcoming": {
    "type": "review-and-retro",
    "date": "2026-05-15",
    "weekday": "Friday",
    "agenda": [
      { "id": "1", "title": "Sprint 7 demo — SEC-1745 walkthrough",                "owner": "alice",   "minutes": 10 },
      { "id": "2", "title": "Velocity & token spend vs. plan",                      "owner": "agent:ORC", "minutes": 8 },
      { "id": "3", "title": "Promote spring-csrf@1.2 to T1?",                       "owner": "bob",     "minutes": 12 },
      { "id": "4", "title": "Adopt v3.3 backup-approver rule",                      "owner": "carol",   "minutes": 10 },
      { "id": "5", "title": "Retro — what to keep, what to drop",                   "owner": "alice",   "minutes": 15 }
    ]
  },
  "past": [
    {
      "type": "review-and-retro",
      "sprint": "S6",
      "date": "2026-05-01",
      "decisions": [
        "Approve spring-sql-injection@2.3 promotion to T1.",
        "Adopt token-budget pause rule (R-03)."
      ],
      "actions": [
        { "id": "A-S6-1", "text": "Draft backup-approver policy proposal", "status": "shipped" },
        { "id": "A-S6-2", "text": "Add regression probe for side-effect endpoints", "status": "shipped" }
      ]
    },
    {
      "type": "review-and-retro",
      "sprint": "S5",
      "date": "2026-04-17",
      "decisions": ["Bump auto-rollback window from 15 to 30 minutes."],
      "actions": [
        { "id": "A-S5-1", "text": "Wire LangSmith traces into Evidence tab", "status": "shipped" }
      ]
    }
  ]
}
